artist,title,artist_id,master_id,main_release_id,release_country,year,album_length,tracks,release_type,genres,styles,artist_profile
Blasfeme,Black Legion,8287884.0,,32987169,UK,2024,32.33,7,"['Album', 'Limited Edition']",['Rock'],['Black Metal'],"Blasfeme is a two piece black metal force, fuelled by heavy metal influences and negative thoughts. From Bristol, UK. "
Dawnwalker,The Unknowing,7622357.0,,32331393,UK,2024,0.0,9,"['LP', 'Album']",['Rock'],['Prog Rock'],"Post-Metal/Rock band from London, UK."
Trash Boat,Heaven Can Wait,3896679.0,,32921493,UK,2024,36.03,11,"['12""', '33 ⅓ RPM', 'Album', 'Stereo']",['Rock'],['Hardcore'],
Caelestra,Bastion,8367186.0,,32682639,UK,2024,48.65,6,['Album'],['Rock'],"['Progressive Metal', 'Post-Metal', 'Black Metal', 'Death Metal']","Caelestra. Bristol, UK. The creation of Fever Sea guitarist/vocalist Frank Harper. Soaring post, black and progressive metal infused with 80's sci-fi synthesizers.

"
Other Half,Dark Ageism,4456943.0,,31040566,UK,2024,0.0,12,"['LP', 'Album', 'Limited Edition']",['Rock'],"['Post-Hardcore', 'Punk']",
Ildganger,For Hver Tanke Mister Sj​æ​len Atter Farve,12767564.0,,30251867,UK,2024,0.0,5,"['LP', 'Album', 'Limited Edition']",['Rock'],['Black Metal'],"Black Metal project from Aarhus, Denmark."
Gnod,Spot Land,1107254.0,,30624286,UK,2024,0.0,5,"['LP', 'Album', 'Limited Edition']","['Electronic', 'Rock']","['Alternative Rock', 'Industrial', 'Drone', 'Minimal', 'Psychedelic Rock', 'Tribal']","Gnod are a British rock band from Salford, Greater Manchester, England. Formed in 2006, the band was described in a review of its 2011 release Ingnodwetrust as ""a collective from Manchester with an ever-rotating list of members."" Its current lineup since 2012 is made up of key members Paddy Shine, Chris Haslam, Marlene Ribeiro, Alex Macarte and Andy Blundell, with a rotating cast of players, including drummers Jesse Webb and John Perry and vocalist Neil Francis."
Ilat Mahru,Incipit Akkadian,12679967.0,,30173384,UK,2024,34.33,4,"['Mini-Album', 'Limited Edition']",['Rock'],['Black Metal'],
Perseus,Into The Silence,220153.0,,30422189,UK,2024,44.37,11,"['Album', 'Limited Edition']",['Rock'],"['Heavy Metal', 'Power Metal']",Heavy/power metal band from Italy
Thank,I Have A Physical Body That Can Be Harmed,6092482.0,,32117175,UK,2024,0.0,10,"['LP', 'Album']","['Hip Hop', 'Rock']","['Noise Rock', 'Post-Punk', 'No Wave']","Noise rock / post-punk / no wave band from Leeds, United Kingdom."
Lungtoucher,Sin Eater,7981115.0,,30252140,UK,2024,0.0,9,"['LP', 'Album', 'Limited Edition', 'Numbered']",['Rock'],"['Black Metal', 'Blackgaze', 'Post-Punk']",One man black metal from South West England
C Turtle,Expensive Thrills,11916422.0,,30035518,UK,2024,0.0,10,"['LP', 'Album', 'Limited Edition']",['Rock'],['Indie Rock'],"	
C Turtle is a London based lo-fi rock group originally formed by Cole Flynn Quirke as a solo project releasing two solo albums before being joined by members Joel Kerr, Mimi Mcveigh and Finlay Burrows. Joel left the band in 2023 and he was replaced by Jimmy Gurvercin on the drums.
The band record all of their music on Tascam four-track cassette recorders to ensure a lo-fi quality."
Lucta,Eterna Lotta,6878726.0,,31384628,UK,2024,0.0,9,"['LP', '45 RPM', 'Album']",['Rock'],"['Hardcore', 'Punk']","Hardcore Punk band from Milano - Sondrio, Italy."
Turin,The Unforgiving Reality In Nothing,14828089.0,,32964687,UK,2024,0.0,10,['Album'],['Rock'],['Deathcore'],
Ink & Fire,Emblazoned Visions Yield Eternity,12250363.0,,31239661,UK,2024,0.0,10,"['LP', 'Album', 'Limited Edition']",['Rock'],['Black Metal'],"Black metal from Chicago, USA."
Campfire Social,They Sound The Same Underwater,7295436.0,,31595047,UK,2024,42.0,11,"['LP', 'Album']",['Rock'],['Emo'],"Emo/Indie Collective, Campfire Social, craft a dynamically rich sound with bright harmonies layered over hypnotic melodies that help to underline a continued theme of self deprecation with a feeling of hope. Believing that music is the best form of therapy there is, a positive message prevails; we’re better together.

Thomas Hyndman - Guitar / Vocals
Carrie Hyndman - Keys / Glock / Vocals
Chris Done - Guitar / Vocals
Michael Deponeo - Guitar / Vocals
Rhys Mather - Bass
Ben Matthews - Drums
"
Sans Froid,"Hello, Boil Brain",15246549.0,,32112297,UK,2024,29.53,8,['Album'],['Rock'],"['Art Rock', 'Alternative Rock', 'Post Rock']",
Thumbsucker,Infinite Regret,15018124.0,,31611301,UK,2024,17.9,20,"['LP', '45 RPM', 'Album']",['Rock'],"['Power Violence', 'Hardcore', 'Punk']","Hardcore powerviolence band from Leicester, UK"
Flamebearer,Brazen,10818784.0,,30650458,UK,2024,0.0,9,"['Album', 'Limited Edition']",['Rock'],"['Heavy Metal', 'Stoner Rock']","Flamebearer are from London and a four-piece heavy rock explosion.
"
Cincinatti Bowtie,Chronicles of the Damned,9475702.0,,31322250,UK,2024,0.0,14,['Album'],['Rock'],['Deathcore'],
Svitogor,The Howling Void,14041978.0,,29507386,UK,2024,60.53,10,"['Album', 'Stereo']",['Rock'],['Black Metal'],"Svitogor is a Croatian Black Metal band founded in 2002, currently based in the U.K."
Paul McCartney,Liverpool Sound Collage,35301.0,,14331959,UK & Europe,2000,58.3,5,['Album'],"['Electronic', 'Rock']","['Dub', 'Downtempo']","Sir James Paul McCartney CH MBE (born 18 June 1942 in Liverpool, England) is a British singer, composer/songwriter, and multi-instrumentalist most famous for being a member of [a=The Beatles]. He is also a published poet, painter, philanthropist, animal rights activist, and multi-media executive/producer. Sir Paul McCartney has been recognised by every music and entertainment association, including Guinness Book, as the most successful and popular composer/songwriter/entertainer in the history of popular music.
After the Beatles disbanded, he debuted as a solo artist with the 1970 album ""[m=39887]"" and formed the band [a=Wings (2)] with his first wife, Linda, and [a=Denny Laine]. He resumed his solo career after Wings broke up in April 1981.
McCartney received appointment as Member of the Order of the British Empire in 1965 and, in 1997, McCartney was knighted for services to music.
He was inducted into the Rock and Roll Hall of Fame in 1988 as a member of the Beatles and again as a solo artist in 1999. On 9 February 2012, he was honoured with the 2.460th star on the Hollywood Walk of Fame.
Widower of [a=Linda McCartney]. Stepfather of [a=Heather McCartney] ([a=Linda Eastman]'s daughter from her first marriage whom he later adopted) and biological father to [a=Mary McCartney], [a=Stella McCartney], [a=James McCartney]. In July 2002, he married [a=Heather Mills] with whom they had a daughter in 2003, Beatrice Milly. They separated in April 2006. On 9 October 2011, he married Nancy Shevell. Son of [a=James McCartney (2)] and brother of [a=Michael McCartney]."
Karnataka,The Storm,1420825.0,,1727511,UK,2000,57.3,10,['Album'],['Rock'],"['Folk Rock', 'Prog Rock']","Progressive Rock band from Swansea, Wales, UK"
Sol Invictus,Trieste,49848.0,,237520,UK,2000,60.47,17,['Album'],"['Electronic', 'Rock']","['Modern Classical', 'Neofolk']","After playing in British punk band [a=Crisis (2)], post punk act [a=Death In June] and his own personal project [a=Above The Ruins], Tony Wakeford founded Sol Invictus in 1987, involving [a=Ian Read] and shortly later [a=Karl Blake] of [a=Lemon Kittens] and [a=Shock Headed Peters]. The music of Sol Invictus on the first recordings was a mixture of acoustic and electronic sounds, creating some epic and dramatic songs which stand against the ""decadence"" of the West and of modern society. This sound characterizes the first three albums, ""Against The Modern World"" (1988), ""In The Jaws Of The Serpent"" (1989) and ""Lex Talionis"" (1990). In 1991 Ian Read left the band to form [a=Fire + Ice], and Wakeford took the sound of Sol Invictus progressively more towards a dark folk approach with changing line-up, such as violinist [a=Matt Howden] and singer and instrumentist [a=Sally Doherty]. Wakeford's recent lyrics tended away from anti-modernism towards more personal themes. Sol Invictus' own self-produced label was [l=S.V.L. Records], then called [l=Cerne] and finally [l=Tursa]."
The Berzerker,Demo's 1998,18529.0,,2900736,UK,2000,27.5,12,"['Album', 'Promo']",['Rock'],"['Grindcore', 'Death Metal']","""The Berzerker is about musically fulfilling the statement 'he who makes a beast of himself, is free from the pain of being a man' The Berzerker is the most natural 
form of extremity known on this planet.""

The Berzerker is an Industrial Death Metal/Grindcore band from Melbourne, Australia. Specializing in Speed, Intensity and aggression. The wall of noise produced by the band encompasses very untraditional drums sound supplied in the form of distorted 909 kick drums, and industrial sound scapes with general destructive elements used to enhance sonic assault. With twin vocal attacks and machine gun vocals rhythms the band stop at nothing to express their hatred on humanity. 

The Berzerker was created as a solo studio project in 1995 and went on to release various EP's on labels such as 
Industrial Strength (USA), Speedcore (GERMANY)and Widerstand (AUSTRIA). 1998 saw the initial contact with Earache Records (UK) with the re-mixes of the Morbid Angel tracks Day of Suffering, Abominations and The Ancient Ones. 
The Berzerker was offered a contract with Earache Records for a number of full-length albums shortly afterwards, 
and in 2000 the Self-Titled album was released and the live act was born. 

The bands first film clip for the track ""Reality"" was banned by the ITC (independent television commission) and MTV due to excessive strobe lighting and horrific images, including the appearance of the band. 

In early 2001 the band headed off on a successful 27 show tour of the USA and Canada.

And in 2002/03 the band embarked on a World Tour to support their album Dissimulate this saw over 100 shows played across Australia, USA, Canada, UK, Germany, Denmark, Holland, Belgium, and many more. They did full month long tours with bands such as toured with such bands as Nile, Napalm Death, Strapping Young Lad, Vader, Immolation and many more...

The Berzerker 2004 AD
"
Tom Hingley,Keep Britain Untidy,65105.0,,526333,UK,2000,40.53,11,['Album'],['Rock'],"['Acoustic', 'Indie Rock']","Vocals, born 9th July 1965, Oxford, England."
Whipping Boy,Whipping Boy,285540.0,,441647,UK,2000,43.32,11,['Album'],['Rock'],"['Alternative Rock', 'Indie Rock']","Irish rock band. Originally active from 1988–1998, they reformed in 2005.

Fearghal McKee (vocals)
Paul Page (guitar)
Myles McDonnell (bass, vocals)
Colm Hassett (drums) 
Killian McGowan (keyboards)"
Geoff Farina,Reverse Eclipse,480330.0,,2094438,UK,2000,37.48,13,['Album'],"['Jazz', 'Rock']",[],"American singer and guitarist, best known as frontman of Karate.

Brother of [a608172]."
Ostara,Secret Homeland,161472.0,,238628,UK,2000,67.93,12,['Album'],['Rock'],"['Pop Rock', 'Neofolk']",
James Grant,My Thrawn Glory,587239.0,,3158255,UK,2000,49.83,13,['Album'],"['Rock', 'Blues']",['Indie Rock'],"James Grant's music career began in 1982 as songwriter and guitarist in [a=Friends Again]. When they split in 1985 he formed [a=Love And Money] and split in 1994. During this time they released four albums. They reformed in 2011.
He then went solo and has released 5 studio albums and has scored the film The Near Room and collaborated with [a=Karen Matheson] on her solo albums. 
"
Miocene,Cellular Memory,958779.0,,1809183,UK,2002,40.6,6,['Album'],['Rock'],[],"Forming in 1998, but consolidating their line-up in 2000, Miocene came to the attention of the manager and promoter Keith Eccles of Keith's Back Yard, and after a series of well-reviewed London shows and a self-organised UK tour with the rockers Hundred Reasons,signed to Dante Bonutto's Infernal Records label
On 10 April 2006, it was announced via the band's MySpace page that Miocene had disbanded."
Counting Crows,Hard Candy,262643.0,,30989143,UK,2002,0.0,15,"['Album', 'Unofficial Release']",['Rock'],"['Southern Rock', 'Alternative Rock']","Counting Crows is an American rock band from Berkeley, California, formed in 1991."
Howards Alias,The Chameleon Script,918301.0,,1393346,UK,2002,37.03,11,['Album'],['Rock'],"['Ska', 'Punk', 'Indie Rock']","Band in the modern UK underground punk scene, formed in 1999 in Southampton, disbanded in 2008. Their music blends an eclectic mix of rock, progressive, punk and ska influences."
The String Cheese Incident,Untying The Not,246185.0,,32414148,UK & Europe,2003,54.35,13,['Album'],"['Jazz', 'Rock', 'Folk, World, & Country']","['Bluegrass', 'Alternative Rock', 'Jazz-Rock', 'Country Rock']","The String Cheese Incident (SCI) is an American band from Crested Butte and Telluride, Colorado, formed in 1993. The band is composed of Michael Kang (acoustic/electric mandolin, electric guitar, and violin), Michael Travis (drums and percussion), Bill Nershi (acoustic guitar, lap steel guitar, and electric slide guitar), Kyle Hollingsworth (piano, organ, Rhodes, and accordion), and Keith Moseley (bass guitar), and, since 2004, Jason Hann (auxiliary percussion).

Their music has elements of bluegrass sounds, as well as rock, electronica, calypso, country, funk, jazz, Latin, progressive rock, reggae, psychedelia and Cotton-Eyed Joe unicorn music. All members write original compositions and sing."
Madman Is Absolute,Compliance Is Compulsory,3157151.0,,9567732,UK,2002,0.0,7,['Mini-Album'],['Rock'],['Metalcore'],
Arkam Asylum,Running With Scissors,224851.0,,834199,UK,2003,39.8,15,['Album'],"['Electronic', 'Rock']","['Electro', 'Hard Rock', 'Industrial']","Formed in 1999, Arkam Asylum have built a fierce reputation across the UK and Europe playing filthy cut-up cyberpunk with the likes of The Chaos Engine, Icon of Coil, Sheep on Drugs, Sigue Sigue Sputnik, Gary Numan, and VNV Nation. Arkam Asylum are: Miette's Brainchild (aka Angel) on guitar apocalypse, Bug on electronica, and Amon Zero on word virus.

AA released their debut album, ""Learn to love your cancer"" in 2001, through independent label Wasp Factory Recordings, and are featured on compilations such as Wasp Factory's ""Working with Children & Animals volume 1"" and ""Moonlight Corporation v1.0"" from US label Sector19. The second album, ""Running with Scissors"", is due for release August 2003 on Wasp Factory.

Now known as Arkasai."
Darkflight,Under The Shadow Of Fear,334729.0,,1301861,UK,2003,40.35,8,['Album'],['Rock'],"['Black Metal', 'Doom Metal']","Atmospheric black/doom metal duo from Varna, Bulgaria.

From the official website:
------------------------------------
Darkflight started in the year 2000, creating a mix of blackened doom metal with fantasy influenced lyrics. In the beginning of 2002, the debut demo ""Obscure"" was completed, with the demo's concept inspired by Adam Nichols's fantasy book, ""The War Of The Lords Veil"". The label Totentroll (Rage of Achilles subsidiary), who specialized in releasing 7"" vinyls of fantasy metal, proposed to release two of the demo tracks as an EP single called ""Alone Somewhere Beyond"". Meanwhile, Darkflight recorded the album ""Under The Shadow Of Fear"" and attracted the attention of the main label. They both decided to focus on releasing a full length and the 7"" EP single was cancelled. The band signed a 2 album record deal, and the album was released on June 30th, 2003.

Darkflight started recordings for the next album called ""The Northern Campaign"". In the middle of 2004, Rage of Achilles announced that it would cease to exist due to financial problems. The band used some of the unfinished album tracks and released an online Promo, while searching for a new label.

A few labels contacted the band during that time and while Darkflight didn't have enough material for a second full length, they decided to join in a split album with another band. Together, Oak Knoll Productions and Konklav Records planned a split release with the French band Ars Moriendi. Unfortunately, Oak Knoll Productions couldn't handle the manufacturing costs, as well as having very serious financial problems, resulting in the canceling of the CD.

During 2007 year the band released the 3rd demo called ""Distant Pain"" and immediately caught the attention of the US based label Ars Magna Recordings. Recording sessions took place in the winter of 2007 and the second full length album named ""Perfectly Calm"" was completed, containing some new songs, the ""Distant Pain"" demo and two of the tracks from the unreleased split album. The album was released on the 6th of June 2008 and contains 8 tracks of nearly 60 minutes of playing time. Currently the band is working on a new full length album with the temporary title ""Closure"".
"
Sputniks Down,Much Was Decided Before You Were Born,43018.0,,594879,UK,2001,47.18,7,['Album'],"['Electronic', 'Rock']",['Post Rock'],"Sputniks Down were a Scottish band, made up of Andy Blue, Martin Healy and David Roy. Signed to Edinburgh's Human Condition Records, Sputniks Down (named after a song by Lou Barlow's Folk Implosion) were a three piece from Bishopbriggs on the outskirts of Glasgow. They produced instrumental electronica based on samplers, guitars, bass and keyboards.

After a handful of gigs, they were signed to Edinburgh's Human Condition record label. In January 2000, their debut EP Monotone Mountain was recorded by Tony Doogan at CaVa Studios. In 2001 they released their debut album, Much Was Decided Before You Were Born. The songs ""Atonement"" and ""Mie Scattering"" featured artists from El Hombre Trajaedo and Long Fin Killie (Luke Sutherland).

Between 2003 and 2003, they played gigs with bands including Life Without Buildings,  American Analog Set, El Hombre Trajeado, and Fly Pan Am. After a tour of Greece in 2003, the band split up."
Fallen To,The Mark,1198317.0,,3005917,UK,2002,43.8,11,['Album'],['Rock'],['Nu Metal'],
Tygers Of Pan Tang,Mystical,407694.0,,4632749,UK,2001,49.37,11,['Album'],['Rock'],"['Heavy Metal', 'Hard Rock']","British Heavy Metal band from Whitley Bay formed in 1978.
Tygers Of Pan Tang was part of the NWOBHM movement."
Crosstide,Seventeen Nautical Miles,1098067.0,,9778795,UK,2002,0.0,10,"['Album', 'Stereo']",['Rock'],"['Indie Rock', 'Emo']","A band from Milwaukie, Oregon."
Ironsword,Ironsword,1523142.0,,1866645,UK,2002,0.0,11,['Album'],['Rock'],['Heavy Metal'],Epic heavy metal band from Portugal.
The Little Explorer,The Little Explorer,1100295.0,,2747168,UK,2003,0.0,8,['Album'],['Rock'],['Emo'],
Man,Undrugged,86936.0,,4183562,UK,2002,49.07,11,['Album'],['Rock'],"['Acoustic', 'Blues Rock', 'Psychedelic Rock']","Welsh band founded in 1968, broke up at the end of 1976, reformed in 1983. Ex [a=The Bystanders]"
Karnataka,Delicate Flame Of Desire,1420825.0,,1726424,UK,2003,61.5,9,['Album'],['Rock'],"['Folk Rock', 'Prog Rock']","Progressive Rock band from Swansea, Wales, UK"
Backworld,Of Silver Sleep,106943.0,,404964,UK,2001,45.12,11,['Album'],['Rock'],"['Folk Rock', 'Neofolk']","Folk/Psychedelic project of American singer and instrumentalist Joseph Budenholzer. Collaborators and contributors include Jarboe (Swans), Rose McDowall (Sorrow), Isobel Campbell (Belle & Sebastian, Gentle Waves), David Tibet and Michael Cashmore (Current 93), Drew McDowall (Coil) and Julia Kent (Angels Of Light, Antony And The Johnsons)."
Jon Gomm,Hypertension,1216628.0,,3642829,UK,2003,57.47,11,['Album'],"['Rock', 'Pop']",['Acoustic'],"Jon Gomm is an acoustic singer-songwriter with an incredible virtuoso guitar style, where he uses one acoustic guitar to create drum sounds, basslines and sparkling melodies all at the same time, and combining styles from blues and jazz to rock and pop. The emphasis is still on the soulful vocals and songwriting however, and his original material is influenced by everything from Robert Johnson to Radiohead.

Jon first laid his hands on a guitar at the age of two (actually it was a ukulele - his parents couldn’t find a guitar small enough). He started taking classical guitar lessons, wrote his first song at the age of six, and at twelve he was accompanying his father, a music critic, to blues gigs in his hometown of Blackpool. Touring musicians would often stay at the Gomm household on the understanding Jon would get a guitar lesson, meaning he had one-to-one instruction from such legends as Walter Trout, Bob Brozman, Sherman Robertson and Norman Beaker (Jack Bruce band).

On leaving school Jon turned down a place at Oxford University to attend The Guitar Institute in London. While there he paid his way through college playing jazz in café-bars, recording as a session guitarist, and even playing Country & Western in working mens clubs for line-dancers.

Eventually he heard the call of the north and moved to Leeds, where he is now based, to study on the Jazz degree course at the music college there. He decided to try his hand at performing solo, and discovered all kinds of new sounds he could make with an acoustic guitar – hitting the surface of it to make snare drum, bass drum and bongo sounds, re-tuning the strings to get bass sounds, and teasing high harmonics from the guitar for synthesizer-like effects. He worked all these techniques into his own songs, and put his years of singing blues into use.

Nowadays he tours Europe, playing at festivals from Rome to Athens, has a huge cult following and is regarded by those in the know as one of the world’s most talented and innovative acoustic guitarists. Even with only one CD so far released he is already cited as an influence by many other performers. His videos are watched thousands of times within days of appearing on Youtube, and his home-recorded CD “Hypertension” has sold over ten thousand copies with no industry backing.
"
Al Atkins,Heavy Thoughts,2202133.0,,5709584,UK,2003,54.45,11,"['Album', 'Reissue']",['Rock'],['Heavy Metal'],"English heavy metal vocalist, born on 11 October 1947 in Stone Cross, West Bromwich, Birmingham, England, UK. Most known for fronting early versions of Judas Priest and co-writing songs on their first two albums including the classic Victim of Changes."
Politicide,Jihad,399737.0,,2236097,UK,2002,0.0,12,['Album'],['Rock'],['Punk'],
Yay Us,"All The Heroes Are Dead, Here We Are",7983350.0,,15546847,UK,2002,32.8,10,"['Album', 'Limited Edition', 'Stereo']",['Rock'],"['Indie Rock', 'Garage Rock', 'Pop Punk', 'New Wave', 'Post-Punk']",
Simian,Chemistry Is What We Are,17226.0,,10237676,UK,2001,43.33,11,"['Album', 'Enhanced']","['Electronic', 'Rock']","['Abstract', 'Indie Rock']","British electronic rock group founded in Manchester in 2000 and disbanded in 2005.

Members:
Simon Lord (vocals, lead guitar, drum programming)
Alex MacNaghten (bass)
James Anthony ""Jas"" Shaw (keyboards, drum programming, percussion)
James Ford (drums, drum programming)

NOTE: Not to be confused with [a=Simian Mobile Disco], which is the band's current electronic offshoot and only consisting of [a=James Ford] and [a=James Shaw (3)]. "
50 Caliber,Internal Bleeding,1101315.0,,2964233,UK,2002,13.87,5,['Mini-Album'],['Rock'],"['Hardcore', 'Deathcore', 'Metalcore']",English death metal-influenced metalcore/hardcore from London.
Colin Vearncombe,Smoke Up Close,335255.0,,1237688,UK,2002,129.58,30,['Album'],['Rock'],['Acoustic'],"English musician and singer-songwriter, born 26 May 1962 in Liverpool, England, died 26 January 2016 in Cork, Ireland due to complications after car accident."
Robin George,Dangerous Music Live '85,585672,,4623549,UK,2004,48.6,12,['Album'],['Rock'],['Pop Rock'],"British rock guitarist, singer, songwriter, and producer, born 1956, Wolverhampton, Staffordshire – died 26 April 2024, Málaga, Spain.

He  has collaborated with several artists during his career including David Byron, Phil Lynott, Glenn Hughes, Robert Plant, and John Wetton."
Voices Of Masada,Four Corners,447124,,676122,UK,2004,42.25,8,['Album'],['Rock'],['Goth Rock'],"""Voices of Masada stop the clock of gothic music history and turn it back by a decade. ""Four Corners"" is the perfect album for those who like to cherish their gothic dreams while tapping their foot to the beat of a drum machine..."" Ascension Magazine 
""...being totally overwhelmed by the languishing, hypnotic and emotional crescendo of the song 'Shine' as well as some other beautiful moments like 'Step down' and ' fragments '. A good production, sepulchral efficient vocals, catchy tunes, what more to say ... The British scene continues to offer us gothic quality"" Dark Spirit In A Candle webzine 

""There are times you're longing for some new gothic rock stuff that will pay tribute to the legendary and influencial bands of the scene, without being copies though, having a personal air, enriching it with their influences and also bringing some fresh air to the scene, without sounding like an ""archaelogical museum"" coming straight from the 80s. One of these bands have to be Voices Of Masada without any shadow of doubt, a band that managed to release one of the best, if not the best, gothic rock releases of 2006, showing wholeheartedly that nothing's lost in this very scene that some consider as dead."" Metalstorm.net

There is a new plan... more to follow!

Eddie Martin, Danny Tartaglia and Rob Leydon have left the Band.
Sam Morrison joined the Live band
Tom Stevenson has joined the band."
Beef Conspiracy,"Hung, Drawn And Quarter Poundered",673899,,2040777,UK,2004,26.42,9,['Album'],['Rock'],['Death Metal'],Death metal band from the United Kingdom.
Mendeed,From Shadows Came Darkness,311084,,3420766,UK,2004,36.18,7,['Album'],['Rock'],['Heavy Metal'],"Metalcore band from Glasgow (Scotland) formed 2000 suspended 2007.

Last line-up  
Dave Proctor: Vocals  
Steph Gildea : Guitar  
Chris Lavery: Bass  
Steven Nixon: Guitar  
Kevin Matthews: Drums 
"
