artist,title,artist_id,master_id,main_release_id,release_country,year,album_length,tracks,release_type,genres,styles,artist_profile
Mother Earth,The Further Adventures Of Mother Earth,27594,,3142257,UK,2004,0.0,16,['Album'],"['Rock', 'Funk / Soul']","['Folk Rock', 'Soul', 'Funk']","UK [l=Acid Jazz] band active in the first half of the 1990s.

For the psychedelic rock band from the 60s, see [a=Mother Earth (4)].
"
Jay & The Americans,She Cried/Come A Little Bit Closer,259630,,11672549,UK,2004,61.18,26,"['Album', 'Compilation', 'Remastered']","['Rock', 'Pop']",['Pop Rock'],"Pop group from Belle Harbor, Queens, NY established 1960."
Marillion,Remixomatosis,218108,,1858830,UK,2004,75.37,14,"['Album', 'Limited Edition']","['Electronic', 'Rock']","['Alternative Rock', 'Ambient']","Marillion formed in Aylesbury, Buckinghamshire, England in 1979. Recording consistently since 1982, their output is generally regarded as comprising two distinct eras, that of original vocalist [a=Fish] who helmed the band at arguably their most popular (critically and commercially), and his replacement, former [a=Europeans] member [a=Steve Hogarth], who joined the band after Fish's departure in 1989. The band's differing styles between the two vocalists has often been known to divide fans."
Jesus Licks,The Band You Can't Avoid,343453,,10724895,UK,2004,0.0,6,['Mini-Album'],"['Rock', 'Pop']",[],
The Levellers,All Star Acoustic Review - Live In Edinburgh - 02-12-2004,23672,,14842126,UK,2004,0.0,26,"['Album', 'Limited Edition', 'Numbered', 'Unofficial Release']",['Rock'],[],"English folk rock band founded in 1988 in Brighton.

Members:
Mark Chadwick (singer, guitar)
Charlie Heather (drums)
Jon Sevink (violin)
Jeremy Cunningham (bass, bazouki)
Simon Friend (guitar, vocals, mandolin, harmonica, 1991-present)
Matt Savage (keyboards, backing vocals, 2004-present) 
Stephen Boakes (didgeridoo)
Alan Miles (vocals, guitar, mandolin, harmonica, 1988-91)"
Roger (11),This Is The Shit,506056,,1554584,UK,2004,54.7,9,['Album'],"['Rock', 'Funk / Soul']",['Funk Metal'],
A Marble Calm,Surfacing,1800770,,2254036,UK,2004,73.38,8,['Album'],"['Electronic', 'Jazz', 'Rock']","['Ambient', 'Art Rock', 'Contemporary Jazz', 'Electroacoustic', 'Folk', 'Modern Classical']",
Umbah,Alien Beauty,3571441,,13812177,UK,2004,52.72,12,"['MP3', 'Album']","['Electronic', 'Rock']","['Avantgarde', 'Death Metal', 'Industrial', 'Grindcore']",
Trash Monroe,Trash Monroe,8404104,,28820827,UK,2004,17.63,5,['Mini-Album'],"['Rock', 'Pop']",['Pop Rock'],
The Levellers,All Star acoustic Review - Telford - 24-11-2004,23672,,14823172,UK,2004,0.0,26,"['Album', 'Limited Edition', 'Numbered', 'Unofficial Release']",['Rock'],[],"English folk rock band founded in 1988 in Brighton.

Members:
Mark Chadwick (singer, guitar)
Charlie Heather (drums)
Jon Sevink (violin)
Jeremy Cunningham (bass, bazouki)
Simon Friend (guitar, vocals, mandolin, harmonica, 1991-present)
Matt Savage (keyboards, backing vocals, 2004-present) 
Stephen Boakes (didgeridoo)
Alan Miles (vocals, guitar, mandolin, harmonica, 1988-91)"
Psychic TV,Godstar: Thee Director's Cut,17926,,352138,UK,2004,122.37,23,"['Album', 'Compilation', 'Remastered']","['Electronic', 'Rock']","['Psychedelic Rock', 'Synth-pop']","Formed: 1981 in Hackney, London, United Kingdom by [a22533] and [a=Peter Christopherson] (after [a=Throbbing Gristle] ceased to exist) with [a=Alex Fergusson]. Soon, Psychic TV became a post-industrial supergroup, expanding the core line-up with the talents of frequent collaborators [a=Monte Cazazza], [a=David Tibet], and [a=John Balance], which led to the classic 1983 album ""[m=17374]."" 

After Peter and John's departure in January 1984 to concentrate on their [a=Coil] project, Psychic TV's style evolved more in the direction of psychedelic or acid rock, then called ""hyperdelic,"" rock by the band, a style they would return to in later years. In 1987, [a=Alex Fergusson] departed, and a move back to more electronic based music took place, initally featuring the talents of [a=Richard Norris] and [a=Dave Ball], and then [a=Fred Giannelli], [a=Greedy Beat Syndicate], and [a=Richard Schiessl]. Psychic TV were found at the forefront of acid house with the fake compilations ""[m=17878],"" ""[m=76308],"" and various releases featuring rotating line-ups under different monikers ([a=Mistress Mix], [a=Sickmob], & [a=DJ Doktor Megatrip]).

Well documented constant touring and recording took its toll. A relocation to the USA in 1993, the closure of the band's independent label [l=Temple Records] in 1994, and perhaps most prominently the separation from [a=Paula P-Orridge] left Genesis P. Orridge to be the only permanent member of Psychic TV. The name ""Psychic TV & Genesis P-Orridge,"" was used for a number of Psychic TV re-releases and experimental projects by Genesis P-Orridge and [a=Larry Thrasher], before Genesis formed [a=Thee Majesty] with [a=Bryin Dall]. A final concert was announced and held at the Royal Festival Hall, London in May 1999. 

In 2003, Genesis P. Orridge (now Breyer P. Orridge) toured with a new line up as PTV3, musically leaning towards the ""hyperdelic,"" phase. Silently, they restarted the once dismissed TOPY and re-activated the dormant Temple Records for a batch of new and old releases.
 
Genesis P-Orridge died after a long battle with leukaemia on 14th March 2020."
Coal Porters,How Dark This Earth Will Shine,306084,,4618077,UK,2004,39.92,11,['Album'],"['Rock', 'Folk, World, & Country']","['Folk Rock', 'Country Rock', 'Bluegrass']","The Coal Porters were a British-American bluegrass band headquartered in London and co-led by Kentuckian Sid Griffin and Scotsman Neil Robert Herd. 

Griffin formed the group in Los Angeles in 1989 and then reorganized the band after moving to London. Joining Griffin are Kerenza Peacock (fine fiddle and vocals),
Paul Fitzgerald (banjo and vocals), Andrew Stafford (bass) and Neil Robert Herd (guitar and vocals).

The Coal Porters disbanded in July 2018.
"
keiretsu,Timestorm,211137,,12855946,UK,2004,0.0,8,['Album'],"['Electronic', 'Hip Hop', 'Rock']",['Electro'],"A live drum'n'bass and breakbeat band from Durham, UK, active 2000-2007."
Nagus,Roughcast,4280929,,11750296,UK,2004,45.48,11,['Album'],"['Rock', 'Folk, World, & Country']","['Folk', 'Folk Rock']","Pembrokeshire, Wales, based folk/world music group formed in 1995 and centred around [a4280928] & [a4280927]. Privately released albums include Roughcast, Bearfoot and Broke, Bearfoot, & On The Hill."
Anhysbys,Twyni Tywod,6054141,,10973959,UK,2004,0.0,8,['Album'],"['Rock', 'Folk, World, & Country']",['Indie Rock'],
Tony Hadley,Tony Hadley V Peter Cox & Go West,59760,,5541338,UK,2004,62.92,14,['Album'],"['Rock', 'Funk / Soul', 'Pop']",[],"English pop singer-songwriter, occasional stage actor and radio presenter , born June 2, 1960 in London, England, UK. He rose to fame in the 1980s as the lead singer of the new wave band [a=Spandau Ballet] before launching a solo career following the group's split in 1990."
Modern Art (2),The Modern Art,515491,,1570503,UK,2004,39.75,8,"['Album', 'Limited Edition']","['Electronic', 'Rock']",['Experimental'],"Electro/synth rock band formed by [a288753] in the early 1980s. Modern Art was predominantly Gary Ramon on various instruments with some guest musicians. The band played live only on several occasions and the project did see the release of a slew of limited cassette only releases, and two studio albums. After moving in a more psychedelic direction, Ramon disbanded MA and formed [a244034] in 1989."
Elguapo,Elguapo,5890930,,15457911,UK,2004,57.23,14,['Album'],"['Rock', 'Funk / Soul']",[],"Funk/rock group from Bristol, UK."
The Husbands (4),"The Husbands Are Dead, Long Live The Husbands!",7617078,,11986458,UK,2004,48.75,17,['Album'],"['Electronic', 'Rock', 'Pop']",['Indie Rock'],Formed 2002 from the ashes of [a=Big Red (29)].
David Bowie,Tokyo 2004,10263,,17227720,UK,2004,0.0,32,"['Album', 'Unofficial Release']","['Rock', 'Pop']","['Art Rock', 'Pop Rock']","British pop/rock singer, musician, songwriter, and actor.

Born: 8 January 1947 in Brixton, London, England, UK.
Died: 10 January 2016 in Manhattan, New York City, USA (aged 69).

Bowie is recognized as one of the most respected contemporary musicians of his period. He was a leading figure in the music industry and is considered one of the most influential musicians of the 20th century.
Inducted into Rock And Roll Hall of Fame in 1996.

For a list of all band and group involvement, please see [b][a1240431][/b]."
ProjeKct Three,"Live In Austin, TX (March 25, 1999)",532366,,739004,UK,2004,78.95,12,"['Album', 'Club Edition']","['Electronic', 'Rock']","['Art Rock', 'Drum n Bass', 'Experimental', 'Ambient']","Part of the ""FraKctalisation"" of the Progressive Rock band [A=King Crimson]. ProjeKct Three is noted as a faster-paced experiment driven primarily by Mastelotto’s multi-layered electronic rhythm approach (which drew extensively on high-speed drum & bass and electronica)."
Coldplay,In Your Place,29735,,5172717,UK,2004,0.0,13,"['Album', 'Unofficial Release']","['Rock', 'Pop']",['Alternative Rock'],"Pop rock band from London, England.
Formed 1997.

[b][u]Line-up:[/u][/b]
Jonny Buckland - Guitar/Keys\Backing vocals (1997-)
Will Champion - Drums/Backing vocals (1998-)
Guy Berryman - Bass/Keys (1997-)
Chris Martin - Vocals/Piano\Acoustic guitar(1997-)
Phil Harvey - Manager/Creative director (1998-2002, 2006-)"
Bill Nelson,Custom Deluxe,22882,,1627330,UK,2004,60.38,15,"['Album', 'Limited Edition']","['Jazz', 'Rock']",['Art Rock'],"Bill Nelson is a British musician, painter and photographer. Born December 18, 1948 in Wakefield, West Yorkshire (England) he is best known as the founder of [a=Be Bop Deluxe] (1972-1978), although he is also a prolific and accomplished solo artist in his own right.

Following an education at Wakefield College Of Art, Bill Nelson's first recorded works were contributions to [l=Holyground] recordings A-Austr: Musics From Holyground (1970) and [r=1393644] (1971). His first solo album [r=1753752] was released on [l=Smile Records] in 1971 and saw notable airplay by John Peel. A year later Bill formed Be Bop Deluxe, a venture that under Nelson's guidance morphed from its initial blues and glam rock beginnings into a stylistically experimental endeavour that encompassed elements of prog rock, new wave, art rock and proto punk. Bill disbanded Be Bop Deluxe in 1978, however these influences were taken further for his next project Red Noise (1978-1979), after recording [r=729832] he concentrated on working as a solo musician and received critical acclaim for his experimental synth-pop releases [r=141538], [r=874805] and [r=1418768]. The latter part of the 1980s saw Nelson progress into increasingly esoteric territory as his personal interest in occult and gnostic beliefs were packaged alongside voluminous ambient albums which were created with the immediacy of creative inspiration. This work ethic saw the release of a staggering amount of music. Despite personal and financial troubles through the late 1980s he has maintained a prolific recorded output and although he does not tour he makes a single public performance each year at annual 'Nelsonica' events in Yorkshire, England."
Ellis Hooks,The Hand Of God,541400,,3818759,UK,2004,0.0,17,['Album'],"['Rock', 'Funk / Soul', 'Blues']","['Soul', 'Memphis Blues', 'Rhythm & Blues']",Singer.
Rev Hammer,Spitting Feathers,657689,,8297555,UK,2004,45.63,12,['Album'],"['Rock', 'Folk, World, & Country']","['Folk', 'Folk Rock']",
Chris T-T,Live Tonight,294311,,5729914,UK,2004,46.75,15,['Album'],"['Rock', 'Folk, World, & Country']","['Indie Rock', 'Folk Rock']","Chris T-T (born Christopher Thorpe-Tracey, 16 September 1974) is an English singer/songwriter based in Brighton."
Original West End Cast,Tonight's The Night: The Rod Stewart Musical,8150909,,15932050,UK,2004,71.73,33,['Album'],"['Rock', 'Pop', 'Stage & Screen']",['Musical'],
Pavlov's Cat,Burlington Road,3313452,,4612648,UK,2004,50.75,12,['Album'],"['Rock', 'Folk, World, & Country']","['Acoustic', 'Folk', 'Folk Rock', 'Indie Rock']",British acoustic/folk band.  Based in London
The Popes,Release The Beast,287451,,3521688,UK,2004,54.1,33,['Album'],"['Rock', 'Folk, World, & Country']",['Folk Rock'],"Irish folk rock group formed in 1992 by [a=Shane MacGowan] as a backing band for his post-[a=The Pogues] efforts but also recording and performing on their own.  After the death of founding member [a=Tom McManamon] in 2006, the band re-emerged with a new lineup led by founding member [a=Paul McGuinness], but has been inactive since he suffered a head injury in 2013. "
Martin Stephenson,Airdrie,283407,,5325338,UK,2004,0.0,11,['Album'],"['Rock', 'Folk, World, & Country']",[],
James Adams,Comeback Crazy,173614,,312941,UK,2004,0.0,18,['Album'],"['Electronic', 'Rock', 'Pop']","['Downtempo', 'New Beat']",
Hayashi (18),Rosebud,10404256,,12501008,UK,2004,0.0,10,['Album'],"['Electronic', 'Rock', 'Pop']","['Indie Rock', 'Downtempo']",
Chocolate O'Brian,Chocolate O'Brian,183128,,14999455,UK,2004,51.3,11,['Album'],"['Hip Hop', 'Rock']",[],
Chester Copperpot (2),The Kings Of Kirby,1174198,,2799009,UK & US,2004,38.2,16,['Album'],['Rock'],"['Pop Rock', 'Punk']",
Decapity,Be Pure Be Vigilant Behave,3678422,,14142984,UK & Europe,2004,37.93,9,['Album'],['Rock'],['Death Metal'],Death metal bandf from UK.
The Levellers,All Star Acoustic Review - Live In Poole - 28-11-2004,23672,,14842031,UK,2004,0.0,26,"['Album', 'Limited Edition', 'Numbered', 'Unofficial Release']",['Rock'],[],"English folk rock band founded in 1988 in Brighton.

Members:
Mark Chadwick (singer, guitar)
Charlie Heather (drums)
Jon Sevink (violin)
Jeremy Cunningham (bass, bazouki)
Simon Friend (guitar, vocals, mandolin, harmonica, 1991-present)
Matt Savage (keyboards, backing vocals, 2004-present) 
Stephen Boakes (didgeridoo)
Alan Miles (vocals, guitar, mandolin, harmonica, 1988-91)"
Mystery Plane,The Mystery Plane,348029,,1570507,UK,2004,0.0,10,"['Album', 'Limited Edition', 'Numbered']","['Electronic', 'Rock']",['Experimental'],
T23 And The Psychedelic Circus,When The Going Gets Weird ,6360837,,11703081,UK,2004,0.0,12,"['Album', 'Limited Edition']","['Electronic', 'Rock']","['Psychedelic Rock', 'Psy-Trance']",
Jake Flowers,The Rooster Got Laid,1444495,,6490639,UK,2004,0.0,7,['Album'],"['Rock', 'Folk, World, & Country']",[],
Benji Kirkpatrick,Half A Fruit Pie,1228990,,5132679,UK,2004,60.55,12,['Album'],"['Rock', 'Folk, World, & Country']","['Folk', 'Folk Rock']","Benji Kirkpatrick was born in the summer of 1976 when his parents, folk luminaries John Kirkpatrick and Sue Harris, were on a rare break from touring. The couple played together as a duo throughout the 70’s and 80’s and with countless classic line ups – Albion Country Band, Steeleye Span, Richard Thompson, Brass Monkey to name but a few.
In the hills of Shropshire, Benji, like other children immersed in the folk world, was brought up listening to a wide range of musical styles. It wasn’t long before he was picking up instruments and with the arrival of an electric guitar into his life, Benji began listening to 50’s Rock n’ Roll, before moving via ZZ Top to Jimi Hendrix.  
At college, Benji formed a band called The Hedgerows, who eventually evolved into an acoustic outfit, resulting in them having a song (penned by Benji) featured on Evolving Tradition 1 (Mrs Casey Records) in 1995. This got Benji’s name noticed and his solo debut (‘Dance in the Shadow’) was released in 1998 on the Wildgoose label. Benji joined the band Dr Faustus in the same year. 
In 2004, Benji’s 2nd solo album, ‘Half a Fruit Pie’, was released, this time on the Fellside label.
In the same year, Folk/funk/jazz/soul big band, Bellowhead was formed and Benji was a founder member. With an appearance on BBC TV’s ‘Later’ and performances everywhere from the Royal Opera House to the Shepherd’s Bush Empire, the band has gone from strength to strength. They are headlining festivals in the UK and in Europe and, following in St Etienne’s footsteps, have recently been named as Band in Residence at London’s South Bank Centre for 2008."
Deckchair Daze,Life's A Lark,7566113,,14580131,UK,2004,0.0,11,['Album'],"['Rock', 'Folk, World, & Country']",['Folk Rock'],
Mik Artistik's Ego Trip,Pulveriser,3415008,,32678022,UK,2004,0.0,14,['Album'],"['Rock', 'Non-Music', 'Pop']",['Pop Punk'],"Mik Artistik's Ego trip are a three-piece group consisting of Mik Artistik, Benson Walker and Jonny Flockton."
Till The Spring,Sign Of The Times,2500869,,3233454,UK,2004,0.0,12,['Album'],"['Folk, World, & Country', 'Rock']","['Acoustic', 'Folk']",
Odd At Ease,The Dark Side Of The Dune,6330087,,11626666,UK,2004,0.0,15,['Album'],"['Rock', 'Folk, World, & Country']",['Folk Rock'],
James Green (2),Tempers,507279,,6341062,UK,2004,28.7,14,['Album'],"['Rock', 'Folk, World, & Country']",['Acoustic'],"Multi-instrumentalist from the 2000s - plays guitars, harmonium, autoharp, piano. "
Frankie Machine,Re-unmelt My Heart,645563,,7701642,UK,2004,40.93,14,['Album'],"['Rock', 'Folk, World, & Country']","['Alternative Rock', 'Folk Rock', 'Acoustic']",
Timothy Victor,Nocturnes,396151,,5730177,UK,2004,43.33,11,['Album'],"['Rock', 'Folk, World, & Country']",[],
Douglas McQueen Hunter,Ghosts,7131699,,15132548,UK,2004,60.65,14,['Album'],"['Rock', 'Folk, World, & Country']","['Celtic', 'Trance']","Scottish singer, songwriter and musician "
Jim Clements (5),Kill Devil Hills,6764968,,12681429,UK,2004,0.0,11,['Album'],"['Rock', 'Folk, World, & Country']",[],
Warblefly,Crashing Through The Trees,955013,,23226626,UK,2004,0.0,11,['Album'],"['Rock', 'Folk, World, & Country']","['Folk Rock', 'Celtic', 'Punk']",
Michelle Heritage,Shine,8293689,,16274826,UK,2004,0.0,5,['Album'],"['Rock', 'Folk, World, & Country']","['Acoustic', 'Religious']",
Morgan Le Fay (2),Beautiful Land,5733483,,11615211,UK,2004,0.0,10,['Album'],"['Rock', 'Folk, World, & Country']",[],"Newcastle band active in 1998 made up of
Michael Bailey
Brereton Preen
Ian Robinson
Mike Swindale
Duncan Tyler"
Bill Nelson,Plaything,22882,,1988614,UK,2004,0.0,12,"['Album', 'Limited Edition']","['Electronic', 'Rock']","['New Age', 'Art Rock']","Bill Nelson is a British musician, painter and photographer. Born December 18, 1948 in Wakefield, West Yorkshire (England) he is best known as the founder of [a=Be Bop Deluxe] (1972-1978), although he is also a prolific and accomplished solo artist in his own right.

Following an education at Wakefield College Of Art, Bill Nelson's first recorded works were contributions to [l=Holyground] recordings A-Austr: Musics From Holyground (1970) and [r=1393644] (1971). His first solo album [r=1753752] was released on [l=Smile Records] in 1971 and saw notable airplay by John Peel. A year later Bill formed Be Bop Deluxe, a venture that under Nelson's guidance morphed from its initial blues and glam rock beginnings into a stylistically experimental endeavour that encompassed elements of prog rock, new wave, art rock and proto punk. Bill disbanded Be Bop Deluxe in 1978, however these influences were taken further for his next project Red Noise (1978-1979), after recording [r=729832] he concentrated on working as a solo musician and received critical acclaim for his experimental synth-pop releases [r=141538], [r=874805] and [r=1418768]. The latter part of the 1980s saw Nelson progress into increasingly esoteric territory as his personal interest in occult and gnostic beliefs were packaged alongside voluminous ambient albums which were created with the immediacy of creative inspiration. This work ethic saw the release of a staggering amount of music. Despite personal and financial troubles through the late 1980s he has maintained a prolific recorded output and although he does not tour he makes a single public performance each year at annual 'Nelsonica' events in Yorkshire, England."
bravecaptain,Allonewordsmallbee,105470,,396872,UK,2004,57.45,7,"['Album', 'Limited Edition']","['Rock', ""Children's""]",['Indie Rock'],Solo project from this former member of The Boo Radleys.
Marzuraan,Solid State,723041,,1151035,UK,2004,60.17,5,"['Album', 'Limited Edition']","['Electronic', 'Rock']","['Doom Metal', 'Drone']","Marzuraan were formed in Gateshead, North East UK and active between 2002-2008 releasing three albums. Line-Up: 
Stu Ellen - Vocals, Pete Burn - Guitar, Lee Stokoe - Bass & Rob Woodcock - Drums. 
Their sound incorporates elements of doom, punk, noise rock, drone, metal & shoegaze.

"
Bill Nelson,Wah-Wah Galaxy,22882,,1627082,UK,2004,67.43,16,"['Album', 'Limited Edition']","['Electronic', 'Rock']",['Art Rock'],"Bill Nelson is a British musician, painter and photographer. Born December 18, 1948 in Wakefield, West Yorkshire (England) he is best known as the founder of [a=Be Bop Deluxe] (1972-1978), although he is also a prolific and accomplished solo artist in his own right.

Following an education at Wakefield College Of Art, Bill Nelson's first recorded works were contributions to [l=Holyground] recordings A-Austr: Musics From Holyground (1970) and [r=1393644] (1971). His first solo album [r=1753752] was released on [l=Smile Records] in 1971 and saw notable airplay by John Peel. A year later Bill formed Be Bop Deluxe, a venture that under Nelson's guidance morphed from its initial blues and glam rock beginnings into a stylistically experimental endeavour that encompassed elements of prog rock, new wave, art rock and proto punk. Bill disbanded Be Bop Deluxe in 1978, however these influences were taken further for his next project Red Noise (1978-1979), after recording [r=729832] he concentrated on working as a solo musician and received critical acclaim for his experimental synth-pop releases [r=141538], [r=874805] and [r=1418768]. The latter part of the 1980s saw Nelson progress into increasingly esoteric territory as his personal interest in occult and gnostic beliefs were packaged alongside voluminous ambient albums which were created with the immediacy of creative inspiration. This work ethic saw the release of a staggering amount of music. Despite personal and financial troubles through the late 1980s he has maintained a prolific recorded output and although he does not tour he makes a single public performance each year at annual 'Nelsonica' events in Yorkshire, England."
SandWitch (4),Crystal Ball,6898173,,12867293,UK,2004,0.0,15,['Album'],"['Rock', 'Folk, World, & Country']","['Folk', 'Folk Rock']",
David Baalham,Any Day Now...,7560802,,14568638,UK,2004,0.0,15,['Album'],"['Rock', 'Folk, World, & Country']","['Folk', 'Folk Rock']",
Saiichi Sugiyama,So Am I,4904330,,15061647,UK & Europe,2004,0.0,14,['Album'],['Rock'],[],"Saiichi Sugiyama, born in Asakusa, Tokyo, Japan (1960) is a British-based guitarist, composer and singer, best known for his writing, production and performing collaborations with Pete Brown, the lyricist for Cream, since 2002 to date.

Sugiyama released his eponymous first album in 1994 backed by Phil Williams and Mike Caswell of Walk on Fire, Andy Smith of Hot chocolate, Cutting Crew’s rhythm section and Zoot Money. Playing on the London blues club circuit, Sugiyama’s on stage bands in 1990s at various times featured Boz Burrell of Bad Company, John Cook of Rory Gallagher Band, Sam Kelly and the guitarist Paul Wassif. The album received airplay by Paul Jones and Sugiyama supported Eric Bell, appeared on Live TV and jammed with Otis Grand and members of Jeff Healey Band at Roadhouse in Covent Garden.

Sugiyama's self-published studio albums in 2000s featured Clem Clempson of Colosseum, Pete Brown (who co-wrote and co-produced the albums), Zoot Money and Ben Matthews of Thunder.

In July 2016, Sugiyama with the producer Mune Sugiyama released a single Melting Away, which was a collaboration with Andy Fraser, the former Free bassist. The track was written by Sugiyama and featured Rietta Austin on vocals, Mune Sugiyama on the drums and Fraser on the bass. The release became one of the last recordings by Andy Fraser. The video of Melting Away became a track of the week on Classic Rock website and Sugiyama was invited to perform at Annual Free Convention in Newcastle in 2016.

Sugiyama plays a Gibson Les Paul guitar and Marshall amplifiers. His guitar style has more than a passing resemblance to that of [a=Peter Green] and has a vibrato technique similar that of [a=Paul Kossoff]."
Marillion,"Pumpehuset Copenhagen, Denmark, 27 & 28 May 1994",218108,,9160675,UK & Europe,2004,120.3,18,['Album'],['Rock'],['Prog Rock'],"Marillion formed in Aylesbury, Buckinghamshire, England in 1979. Recording consistently since 1982, their output is generally regarded as comprising two distinct eras, that of original vocalist [a=Fish] who helmed the band at arguably their most popular (critically and commercially), and his replacement, former [a=Europeans] member [a=Steve Hogarth], who joined the band after Fish's departure in 1989. The band's differing styles between the two vocalists has often been known to divide fans."
Laura Cantrell,When The Roses Bloom Again And The Hello Recordings,260075,,1897063,UK,2004,56.75,19,['Album'],['Rock'],['Country Rock'],"American country singer-songwriter and DJ born July 16, 1967 in Nashville, Tennessee.
Wife of [a1504574]."
Billy Mahonie,Dust,53515,,1620647,UK & Europe,2004,0.0,5,['Album'],['Rock'],['Post Rock'],"Instrumental rock group from London, UK.

Original line-up : Gavin Baker (guitar), Hywell Dinsdale (bass, guitar), Kevin Penney (bass), Howard Monk (drums) from 1997 to 2001. Between 2002 and 2004 Dinsdale and Penney were replaced by Anthony Barrett (guitar) and Duncan Brown (bass). From 2005 to 2009 the band was Baker and Monk in the studio and the original line up for live shows. The original lineup have since reformed.
"
